{
  "schema_version": "1.0",
  "contexts": [
    "school",
    "office",
    "medical",
    "onsen_bath",
    "bondage_sm",
    "traditional",
    "nightlife",
    "domestic",
    "transit",
    "outdoor",
    "dining",
    "adult",
    "special",
    "generic"
  ],
  "slots": [
    "clothing",
    "character",
    "makeup",
    "hairstyle",
    "jewelry",
    "props",
    "tattoo",
    "liquids",
    "pose",
    "expression",
    "lighting",
    "film",
    "shot_type",
    "camera_angle"
  ],
  "signal_weights": {
    "scene": 1.0,
    "theme": 0.6
  },
  "mixture": {
    "global": 0.15,
    "affinity": 0.85
  },
  "matrix": {
    "school": {
      "clothing": {
        "mode": "weighted",
        "candidates": [
          {
            "id": "jk_seifuku",
            "weight": 1.0
          },
          {
            "id": "blazer_uniform",
            "weight": 1.0
          },
          {
            "id": "gym_uniform",
            "weight": 1.0
          },
          {
            "id": "korean_school",
            "weight": 1.0
          }
        ]
      },
      "character": {
        "mode": "weighted",
        "candidates": [
          {
            "id": "jk_schoolgirl",
            "weight": 1.0
          },
          {
            "id": "strict_teacher",
            "weight": 1.0
          }
        ]
      },
      "makeup": {
        "mode": "weighted",
        "candidates": [
          {
            "id": "natural_pure",
            "weight": 1.0
          },
          {
            "id": "cute_peachy",
            "weight": 1.0
          },
          {
            "id": "sweet_peach_milk",
            "weight": 1.0
          },
          {
            "id": "clear_water_bare",
            "weight": 1.0
          }
        ]
      },
      "hairstyle": {
        "mode": "weighted",
        "candidates": [
          {
            "id": "twin_tails",
            "weight": 1.0
          },
          {
            "id": "high_ponytail",
            "weight": 1.0
          },
          {
            "id": "long_straight_black",
            "weight": 1.0
          },
          {
            "id": "braided_twins",
            "weight": 1.0
          },
          {
            "id": "bob_cut",
            "weight": 1.0
          }
        ]
      },
      "jewelry": {
        "mode": "weighted",
        "candidates": [
          {
            "id": "ribbon_bow",
            "weight": 1.0
          },
          {
            "id": "gold_collarbone_chain",
            "weight": 1.0
          }
        ]
      },
      "props": {
        "mode": "weighted",
        "candidates": [
          {
            "id": "glasses_reading",
            "weight": 1.0
          },
          {
            "id": "smartphone_recording",
            "weight": 1.0
          },
          {
            "id": "sex_toy_vibrator",
            "weight": 1.0
          },
          {
            "id": "plush_doll_teddy",
            "weight": 1.0
          }
        ]
      },
      "tattoo": {
        "mode": "neutral"
      },
      "liquids": {
        "mode": "weighted",
        "candidates": [
          {
            "id": "sweat_glistening",
            "weight": 1.0
          },
          {
            "id": "none",
            "weight": 1.0
          }
        ]
      },
      "pose": {
        "mode": "weighted",
        "candidates": [
          {
            "id": "sitting",
            "weight": 1.0
          },
          {
            "id": "standing",
            "weight": 1.0
          },
          {
            "id": "dynamic",
            "weight": 1.0
          }
        ]
      },
      "expression": {
        "mode": "weighted",
        "candidates": [
          {
            "id": "emotion_shy",
            "weight": 1.0
          },
          {
            "id": "emotion_playful",
            "weight": 1.0
          },
          {
            "id": "emotion_restrained",
            "weight": 1.0
          }
        ]
      },
      "lighting": {
        "mode": "weighted",
        "candidates": [
          {
            "id": "lighting_japanese_fresh",
            "weight": 1.0
          },
          {
            "id": "lighting_backlit_hair",
            "weight": 1.0
          },
          {
            "id": "lighting_studio_commercial",
            "weight": 1.0
          }
        ]
      },
      "film": {
        "mode": "weighted",
        "candidates": [
          {
            "id": "fujifilm_superia_400",
            "weight": 1.0
          },
          {
            "id": "fujifilm_pro_400h",
            "weight": 1.0
          },
          {
            "id": "kodak_portra_400",
            "weight": 1.0
          }
        ]
      },
      "shot_type": {
        "mode": "weighted",
        "candidates": [
          {
            "id": "medium_close_up",
            "weight": 1.0
          },
          {
            "id": "medium_shot",
            "weight": 1.0
          },
          {
            "id": "full_body_shot",
            "weight": 1.0
          }
        ]
      },
      "camera_angle": {
        "mode": "weighted",
        "candidates": [
          {
            "id": "eye_level",
            "weight": 1.0
          },
          {
            "id": "high_angle",
            "weight": 1.0
          },
          {
            "id": "over_the_shoulder",
            "weight": 1.0
          }
        ]
      }
    },
    "office": {
      "clothing": {
        "mode": "weighted",
        "candidates": [
          {
            "id": "ol_suit",
            "weight": 1.0
          },
          {
            "id": "knit_sweater",
            "weight": 1.0
          },
          {
            "id": "evening_dress",
            "weight": 1.0
          },
          {
            "id": "street_casual",
            "weight": 1.0
          }
        ]
      },
      "character": {
        "mode": "weighted",
        "candidates": [
          {
            "id": "ol_subordinate",
            "weight": 1.0
          },
          {
            "id": "female_boss",
            "weight": 1.0
          },
          {
            "id": "strict_teacher",
            "weight": 1.0
          }
        ]
      },
      "makeup": {
        "mode": "weighted",
        "candidates": [
          {
            "id": "mature_wife",
            "weight": 1.0
          },
          {
            "id": "sultry_smoky",
            "weight": 1.0
          },
          {
            "id": "natural_pure",
            "weight": 1.0
          },
          {
            "id": "asian_hybrid_contour",
            "weight": 1.0
          }
        ]
      },
      "hairstyle": {
        "mode": "weighted",
        "candidates": [
          {
            "id": "low_ponytail",
            "weight": 1.0
          },
          {
            "id": "collarbone_lob",
            "weight": 1.0
          },
          {
            "id": "big_wavy_curls",
            "weight": 1.0
          },
          {
            "id": "messy_bun",
            "weight": 1.0
          }
        ]
      },
      "jewelry": {
        "mode": "weighted",
        "candidates": [
          {
            "id": "pearl_necklace",
            "weight": 1.0
          },
          {
            "id": "gold_collarbone_chain",
            "weight": 1.0
          },
          {
            "id": "leather_choker",
            "weight": 1.0
          }
        ]
      },
      "props": {
        "mode": "weighted",
        "candidates": [
          {
            "id": "glasses_reading",
            "weight": 1.0
          },
          {
            "id": "wine_glass_bottle",
            "weight": 1.0
          },
          {
            "id": "smartphone_recording",
            "weight": 1.0
          },
          {
            "id": "digital_camera_record",
            "weight": 1.0
          }
        ]
      },
      "tattoo": {
        "mode": "neutral"
      },
      "liquids": {
        "mode": "weighted",
        "candidates": [
          {
            "id": "sweat_glistening",
            "weight": 1.0
          },
          {
            "id": "none",
            "weight": 1.0
          }
        ]
      },
      "pose": {
        "mode": "weighted",
        "candidates": [
          {
            "id": "sitting",
            "weight": 1.0
          },
          {
            "id": "standing",
            "weight": 1.0
          }
        ]
      },
      "expression": {
        "mode": "weighted",
        "candidates": [
          {
            "id": "emotion_restrained",
            "weight": 1.0
          },
          {
            "id": "emotion_detached",
            "weight": 1.0
          },
          {
            "id": "emotion_seductive",
            "weight": 1.0
          }
        ]
      },
      "lighting": {
        "mode": "weighted",
        "candidates": [
          {
            "id": "lighting_studio_commercial",
            "weight": 1.0
          },
          {
            "id": "lighting_cinematic_dark",
            "weight": 1.0
          },
          {
            "id": "lighting_japanese_fresh",
            "weight": 1.0
          }
        ]
      },
      "film": {
        "mode": "weighted",
        "candidates": [
          {
            "id": "fujifilm_classic_chrome",
            "weight": 1.0
          },
          {
            "id": "kodak_portra_400",
            "weight": 1.0
          },
          {
            "id": "cinestill_800t",
            "weight": 1.0
          }
        ]
      },
      "shot_type": {
        "mode": "weighted",
        "candidates": [
          {
            "id": "medium_shot",
            "weight": 1.0
          },
          {
            "id": "medium_close_up",
            "weight": 1.0
          },
          {
            "id": "medium_long_shot",
            "weight": 1.0
          }
        ]
      },
      "camera_angle": {
        "mode": "weighted",
        "candidates": [